name,linkedin_url,snippet
Leveling Up with Eric Siu,https://www.linkedin.com/in/ericosiu,"I manage sales, operations, marketing, culture and the overall vision. Leveling Up with Eric Siu. 12 years 11 months."
Neil Patel,https://www.linkedin.com/in/neilkpatel,"Co-Founder at Neil Patel Digital · I am a New York Times bestselling author. The Wall Street Journal calls me a top influencer on the web, Forbes says I am ..."
Ahrefs,https://uk.linkedin.com/in/thinkingslow,"Ryan Law, Ahrefs, The University of Sheffield, About, I'm a content marketer that's worked with a whole heap of startups and enterprise."
Julian Goldie SEO,https://www.linkedin.com/in/m-shahbaz-baig,"SEO Consultant | Helping Local Businesses Generate More Calls, Leads & Visibility Through Google Maps SEO, Organic Rankings & AI Overviews emerging AI-driven ..."
Julia McCoy,https://www.linkedin.com/in/juliaemccoy,"Julia McCoy · Liberate humanity from work drudgery | World's first YouTube clone | Founder, FirstMovers.ai · View mutual connections with Julia · Services."
Paperclick,https://www.linkedin.com/in/jordanpink1,Experience: Paperclick Marketing · Education: Middlesbrough College · Location: Greater Middlesbrough and Stockton Area · 500+ connections on LinkedIn.
Vasco's SEO Tips,https://au.linkedin.com/in/ee-chien-chua-772437112,Branding and Communications · I am passionate about all things related to branding and creative writing. · Experience: Integrated Oncology Centres ...
Surfer Academy,https://www.linkedin.com/in/lukasberc,"I hold certifications from Surfer Academy, Ahrefs (Top Scorer), Google/UC Davis, and Edureka. I'm passionate about building scalable systems, leveraging AI to ..."
Simplilearn,https://in.linkedin.com/in/shiwani-jha,"As a Senior Research Analyst at Simplilearn, I lead the content team focused on creating compelling, research-driven videos and courses on Generative AI, ..."
Decoding Blackhat,https://in.linkedin.com/in/rahul-pathak-302a23218,"... SEO performance, generating 60% of traffic organically and managed YouTube channels (Decoding Ads & Decoding Blackhat) to grow reach and engagement. As a ..."
Umar Tazkeer ,https://in.linkedin.com/in/umartazkeer,"Umar Tazkeer. Founder @UT Digital Media | Featured - IndiaToday, University Gold Medalist | Data-driven Performance Marketer | Google Ads, Analytics & GTM ..."
Dotinacademy,https://in.linkedin.com/in/hamzad-basheer,Hamzad Basheer. Founder & CEO at Dotin Digital Academy | Director at Offenso Hackers Academy | Growth Marketer driving EdTech innovations. Dotinacademy ...
CrowdReply,https://pt.linkedin.com/in/dawoodkhan66,Co-founder @ CrowdReply.io | Fastest Growing Reddit Marketing & AI Visibility Platform · I'm a young entrepreneur who loves to build products that solve ...
Digital Sam - Digital Marketing Telugu ,https://in.linkedin.com/in/sam-sampoorna-61a735216,Experience: Ai Powered Digital Marketing Training Academy · Education: Little Flower High School · Location: 500025 · 13 connections on LinkedIn. View Sam ...
Arvow,https://www.linkedin.com/in/vascoamonteiro,Arvow is a B2B SaaS for SEO and marketing automation that helps companies increase their lead flow through search engines and LLMs. Vettted. Graphic. Founder & ...
AI SEO Secrets,https://www.linkedin.com/in/julie-su-33a1712a3,"Experience: Paraflow AI · Location: China · 500+ connections on LinkedIn. View Julie Su's profile on LinkedIn, a professional community of 1 billion ..."
Codefreex,https://www.linkedin.com/in/shubhamkrsinha,"I'm the Founder & CEO of Codefreex, where we help startups, entrepreneurs, and growing brands build digital systems that actually move the business forward."
AI Buzz,https://www.linkedin.com/in/alannaking,"Embracer of change, challenges and big ideas. Strategic marketing and communications… · Experience: Infios · Location: Bentonville · 500+ connections on ..."
Digiprenueur,,
Cameron Taylor,https://www.linkedin.com/in/camerontaylor91,"Hello, how are you? My name is Cameron Taylor. I am an SEO, GEO, AEO, AIO, (insert 3-letter hype here), and Data Analytics Professional based in the USA."
AI Master,https://www.linkedin.com/in/sophieharpool,Growth @ Ramp | Applied AI Master's Student at Northeastern · I help brands stay discoverable in the evolving search landscape—from traditional Google SERPs ...
Behzad Hussain,https://pk.linkedin.com/in/behzad-hussain,"Rank Brilliance, founded by Behzad Hussain, is a forward-thinking SEO agency ... Through strategic internal linking and AI-driven content briefs, we ..."
AI SEO Show,https://hr.linkedin.com/in/nedaperi%C5%A1i%C4%87,Experience · White Light Digital Marketing Graphic. Head of Operations & SEO Client Services. White Light Digital Marketing. Oct 2022 - Present 3 years 8 months.
Caleb Ulku,https://www.linkedin.com/in/calebulku,"Caleb Ulku, MBA, ABI · Creator of AI SEO Mastery | Local SEO Expert for Agencies & Freelancers | Teaching Implementation Over Theory · View mutual connections ..."
Backlinko,https://www.linkedin.com/in/brankokral,"I help technology and health companies grow authority and revenue. Ex head of Backlinko at Semrush, content agency founder with exit, analytics director."
